{
  "schema_version": 1,
  "id": "open_world_enemy_camp",
  "display_name": "Open World Enemy Camp",
  "description": "Fixture playtest for traversing into sector 0/0 and validating enemy camp spawn and streaming budgets.",
  "seed": 1337,
  "duration_secs": 45,
  "setup": {
    "LoadWorld": "assets/worlds/open_world_studio.ron"
  },
  "input_script": [
    {
      "at_secs": 0,
      "action": {
        "SpawnPlayer": {
          "pawn": "assets/pawns/hero_explorer.ron",
          "player_id": 0,
          "team": 1,
          "at_spawn_point": "sector_0_0_west"
        }
      }
    },
    {
      "at_secs": 1,
      "action": {
        "Move": {
          "player_id": 0,
          "x": 1,
          "y": 0,
          "duration_secs": 12
        }
      }
    },
    {
      "at_secs": 16,
      "action": {
        "Wait": {
          "duration_secs": 4
        }
      }
    },
    {
      "at_secs": 24,
      "action": {
        "ActivateAbility": {
          "ability": "assets/abilities/basic_ranged_attack.ron",
          "player_id": 0,
          "target": "camp_guard_0"
        }
      }
    }
  ],
  "assertions": [
    {
      "name": "sector_0_0_active",
      "check": {
        "SectorActive": "sector_0_0"
      }
    },
    {
      "name": "camp_guard_spawned",
      "check": {
        "EntityExists": "camp_guard_0"
      }
    },
    {
      "name": "sector_load_budget",
      "check": {
        "BudgetWithin": {
          "metric": "sector_load_p95_ms",
          "max": 400
        }
      }
    },
    {
      "name": "sector_crossing_hitch_budget",
      "check": {
        "BudgetWithin": {
          "metric": "sector_crossing_hitch_ms",
          "max": 6
        }
      }
    },
    {
      "name": "no_crash",
      "check": {
        "NoCrash": true
      }
    }
  ],
  "artifacts": [
    "log",
    "trace",
    "profile",
    "screenshot"
  ]
}
